{
  "$schema": "https://vortikregistry.github.io/vortik-open-schema/protocol-context.schema.json",
  "contract": "vortik.protocol-context/1.0.0",
  "reviewed_at": "2026-10-30",
  "scope": "Independent, dated source context for selected Ethereum concepts. The October 30 review checks nine selected EIP document states, fork assignments, the Hoodi postponement and changed monitored source files. Other research and application notes retain their previous dated reviews. The separate proposal catalog is an October 30 metadata snapshot, not a technical audit of every proposal. This does not verify runtime health or ENS resolution.",
  "registry": {
    "version": "0.6.5",
    "last_updated": "2026-09-13",
    "path": "registry.json"
  },
  "review_path": "research/protocol-freshness-2026-10-30.md",
  "anchors": [
    {
      "id": "epbs",
      "ens": "epbs.eth",
      "display_term": "ePBS",
      "context_kind": "protocol",
      "summary": "EIP-7732 separates proposer and builder duties. EIP-8282 defines builder deposit, top-up and exit requests.",
      "boundary": "Scheduled proposal inclusion is separate from activation. Hoodi was postponed with no replacement date; Glamsterdam mainnet remains unscheduled in the reviewed sources.",
      "anchor_path": "anchors/epbs.md",
      "sources_path": "schemas/epbs/1.0-draft/sources.md",
      "source_refs": [
        "eip-7732",
        "eip-8282",
        "glamsterdam-meta",
        "glamsterdam-activation",
        "glamsterdam-hoodi-announcement",
        "glamsterdam-hoodi-delay"
      ],
      "eip_refs": [
        7732,
        8282
      ]
    },
    {
      "id": "inclusionlist",
      "ens": "inclusionlist.eth",
      "display_term": "FOCIL / inclusion lists",
      "context_kind": "protocol",
      "summary": "EIP-7805 specifies fork-choice enforcement of inclusion lists and is scheduled for Hegotá.",
      "boundary": "Draft document status and scheduled fork assignment are separate facts. The reviewed Hegotá meta EIP leaves Sepolia, Hoodi and Mainnet activation schedules unset.",
      "anchor_path": "anchors/inclusionlist.md",
      "sources_path": "schemas/inclusionlist/0.1-draft/sources.md",
      "source_refs": [
        "eip-7805",
        "hegota-meta"
      ],
      "eip_refs": [
        7805
      ]
    },
    {
      "id": "commitmentlayer",
      "ens": "commitmentlayer.eth",
      "display_term": "Commitments",
      "context_kind": "research",
      "summary": "ePBS uses a builder's signed commitment before the payload is revealed.",
      "boundary": "The EIP links provide examples of commitments; they do not standardize a standalone commitment layer.",
      "anchor_path": "anchors/commitmentlayer.md",
      "sources_path": "schemas/commitmentlayer/0.1-draft/sources.md",
      "source_refs": [
        "eip-7732",
        "eip-8282",
        "preconfirmation-research"
      ],
      "eip_refs": [
        7732,
        8282
      ]
    },
    {
      "id": "preconflayer",
      "ens": "preconflayer.eth",
      "display_term": "Preconfirmations",
      "context_kind": "research",
      "summary": "Preconfirmation designs examine assurances about inclusion or execution before later protocol confirmation.",
      "boundary": "Guarantees and enforcement depend on the design. A preconfirmation is not consensus finality or one standardized L1 service.",
      "anchor_path": "anchors/preconflayer.md",
      "sources_path": "schemas/preconflayer/0.1-draft/sources.md",
      "source_refs": [
        "preconfirmation-research"
      ],
      "eip_refs": []
    },
    {
      "id": "ssf",
      "ens": "fastfinality.eth",
      "display_term": "Fast Finality / SSF",
      "context_kind": "research",
      "summary": "Fast Finality is an Ethereum research area; single-slot finality is a narrower target within it.",
      "boundary": "The canonical registry entry remains SSF. The broader name does not identify one scheduled fork feature.",
      "anchor_path": "anchors/fastfinality.md",
      "sources_path": "schemas/ssf/0.1-research/sources.md",
      "source_refs": [
        "fast-finality-research"
      ],
      "eip_refs": []
    },
    {
      "id": "buildermarket",
      "ens": "buildermarket.eth",
      "display_term": "Builders",
      "context_kind": "editorial",
      "summary": "EIP-7732 describes builder bids, proposer payments and payload reveal duties; EIP-8282 covers builder request paths.",
      "boundary": "The registry's deprecated label applies to its broad abstraction, not to the existence of builders or builder competition.",
      "anchor_path": "anchors/buildermarket.md",
      "sources_path": "schemas/buildermarket/0.1-research/sources.md",
      "source_refs": [
        "eip-7732",
        "eip-8282",
        "glamsterdam-meta"
      ],
      "eip_refs": [
        7732,
        8282
      ]
    },
    {
      "id": "solverlayer",
      "ens": "solverlayer.eth",
      "display_term": "Solvers",
      "context_kind": "application",
      "summary": "CoW Protocol documents an application surface where solvers compete to execute orders.",
      "boundary": "An application solver is distinct from an Ethereum consensus duty. The source does not define a native L1 solver layer.",
      "anchor_path": "anchors/solverlayer.md",
      "sources_path": "schemas/solverlayer/0.1-research/sources.md",
      "source_refs": [
        "cow-protocol-api"
      ],
      "eip_refs": []
    },
    {
      "id": "executionmarket",
      "ens": "executionmarket.eth",
      "display_term": "Execution",
      "context_kind": "editorial",
      "summary": "Payload coordination, block access lists and gas accounting describe distinct execution surfaces. The Hoodi delay concerns investigation of EIP-8037 contract interactions.",
      "boundary": "These related EIPs do not standardize a single execution-market object. BAL sidecars have a separate, declined Hegotá assignment.",
      "anchor_path": "anchors/executionmarket.md",
      "sources_path": "schemas/executionmarket/0.1-research/sources.md",
      "source_refs": [
        "eip-7732",
        "eip-7928",
        "eip-8037",
        "eip-8038",
        "eip-8146",
        "glamsterdam-meta",
        "hegota-meta",
        "glamsterdam-hoodi-delay"
      ],
      "eip_refs": [
        7732,
        7928,
        8037,
        8038,
        8146
      ]
    },
    {
      "id": "orderflowauction",
      "ens": "orderflowauction.eth",
      "display_term": "Order flow auctions",
      "context_kind": "application",
      "summary": "MEV-Share is a documented order flow auction design operating outside Ethereum consensus.",
      "boundary": "FOCIL provides separate inclusion constraints. Its scheduling alone establishes no trend in order flow auction adoption.",
      "anchor_path": "anchors/orderflowauction.md",
      "sources_path": "schemas/orderflowauction/0.1-research/sources.md",
      "source_refs": [
        "mev-share",
        "eip-7805",
        "hegota-meta"
      ],
      "eip_refs": [
        7805
      ]
    },
    {
      "id": "provingmarket",
      "ens": "provingmarket.eth",
      "display_term": "Execution proofs / proving",
      "context_kind": "research",
      "summary": "EIP-8025 proposes opt-in execution proofs and is Declined for Inclusion in Hegotá.",
      "boundary": "The proposal remains Draft and introduces no prover incentives. A declined fork assignment does not standardize or invalidate a proving-market category.",
      "anchor_path": "anchors/provingmarket.md",
      "sources_path": "schemas/provingmarket/0.1-research/sources.md",
      "source_refs": [
        "eip-8025",
        "hegota-meta"
      ],
      "eip_refs": [
        8025
      ]
    },
    {
      "id": "sequencingmarket",
      "ens": "sequencingmarket.eth",
      "display_term": "Rollup sequencing",
      "context_kind": "research",
      "summary": "Based-rollup research describes sequencing using L1 proposers together with builders and searchers.",
      "boundary": "Sequencing rules depend on the rollup. A broad sequencing-market term does not identify one Ethereum consensus feature.",
      "anchor_path": "anchors/sequencingmarket.md",
      "sources_path": "schemas/sequencingmarket/0.1-research/sources.md",
      "source_refs": [
        "based-rollup-research"
      ],
      "eip_refs": []
    },
    {
      "id": "blockspacemarket",
      "ens": "blockspacemarket.eth",
      "display_term": "Blockspace / fees",
      "context_kind": "editorial",
      "summary": "EIP-1559 provides a concrete reference for the base fee and transaction fee accounting.",
      "boundary": "Vortik's deprecated abstraction is not an Ethereum deprecation of the economic concept. The Final EIP status is not a live network check.",
      "anchor_path": "anchors/blockspacemarket.md",
      "sources_path": "schemas/blockspacemarket/0.1-research/sources.md",
      "source_refs": [
        "eip-1559"
      ],
      "eip_refs": [
        1559
      ]
    }
  ],
  "eips": [
    {
      "number": 1559,
      "title": "Fee market change for ETH 1.0 chain",
      "document_status": "Final",
      "fork": null,
      "source_ref": "eip-1559"
    },
    {
      "number": 7732,
      "title": "Enshrined Proposer-Builder Separation",
      "document_status": "Last Call",
      "fork": {
        "name": "Glamsterdam",
        "assignment": "scheduled",
        "source_ref": "glamsterdam-meta"
      },
      "source_ref": "eip-7732"
    },
    {
      "number": 7805,
      "title": "Fork-choice enforced Inclusion Lists (FOCIL)",
      "document_status": "Draft",
      "fork": {
        "name": "Hegotá",
        "assignment": "scheduled",
        "source_ref": "hegota-meta"
      },
      "source_ref": "eip-7805"
    },
    {
      "number": 7928,
      "title": "Block-Level Access Lists",
      "document_status": "Last Call",
      "fork": {
        "name": "Glamsterdam",
        "assignment": "scheduled",